{
  "schema": "dreamco.data_package_synthesis_asset.v1",
  "asset_id": "edu-co-40.0599",
  "title": "Study plan: Chemistry, Other (CIP 40.0599)",
  "capability_ids": [
    "career-pathway-study-plan"
  ],
  "perspectives_used": [
    "official_documentation"
  ],
  "source_refs": [
    {
      "source_id": "onet_db_31_0",
      "version": "31.0",
      "pinned_by": "provenance.json#sources",
      "perspective": "official_documentation"
    },
    {
      "source_id": "onet_db_31_0_jobzones_tasks",
      "version": "31.0",
      "pinned_by": "provenance.json#sources",
      "perspective": "official_documentation"
    },
    {
      "source_id": "onet_cip_soc_crosswalk",
      "version": "CIP 2020 to O*NET-SOC 2019 (sha256-pinned; the file states no revision date)",
      "pinned_by": "provenance.json#sources",
      "perspective": "official_documentation"
    }
  ],
  "ownership_class": "open_license_with_conditions",
  "commercial_redistribution_allowed": true,
  "attribution_required": true,
  "share_alike_required": false,
  "human_layer": {
    "path": "study_plans/40.0599_chemistry_other.md",
    "format": "markdown",
    "sha256": "edb9ca52a4163f54cc32c14dff63671886e0c9e5d99b38058a4527274521565c",
    "elements": [
      "linked occupations with Job Zones",
      "key knowledge areas",
      "key Essential Skills",
      "entry-level targets (rule output, not reviewed)",
      "4-year outline (element names only)",
      "typical next steps",
      "template practice exercises quoting O*NET task statements"
    ]
  },
  "machine_layer": {
    "path": "study_plans/40.0599_chemistry_other/plan.json",
    "format": "json",
    "sha256": "218fbb6ff0463f40f780af8cfa321ad6fbfc00e1fe63bb7e87a0822defe0069e",
    "elements": [
      "tier",
      "occupations",
      "top_knowledge",
      "top_skills",
      "entry_targets",
      "entry_target_review",
      "practice_tasks",
      "rubrics",
      "reference_answer_outlines"
    ]
  },
  "dreamco_analysis": {
    "agree": [
      "All 5 crosswalk links for CIP 40.0599 resolve to O*NET 31.0 occupation codes (tests check this).",
      "Entry targets are O*NET Job Zone 4 linked occupations: Chemists; Water Resource Specialists; Clinical Research Coordinators.",
      "Tier generated: entry targets are the unreviewed rule output; nobody checked them for plausibility."
    ],
    "reject": [
      "Not used as entry targets (leadership, faculty, or residual titles): Natural Sciences Managers; Chemistry Teachers, Postsecondary."
    ],
    "improve": [
      "Knowledge and skill importance is an unweighted mean over all linked occupations, so leadership and faculty roles still shape the top-knowledge list.",
      "Generated tier: the outline lists O*NET element names without course topics, and practice exercises share one template; authoring this major would replace both."
    ],
    "still_need_test": [
      "Practice exercises are one fixed template around quoted O*NET task statements; they were not individually authored, reviewed, or piloted with learners.",
      "No sandbox, benchmark or holdout evaluation exists: this box has no independent model API key or human graders, and a self-graded run would not be independent evidence.",
      "DreamCo-original text has not had owner review.",
      "No regression evidence exists for generated-tier plans: they are new in this release, so there is no previous release to compare against."
    ]
  },
  "validation_evidence_ids": {
    "sandbox": [],
    "benchmark": [],
    "holdout": [],
    "regression": []
  },
  "integrity_hash": "sha256:edb9ca52a4163f54cc32c14dff63671886e0c9e5d99b38058a4527274521565c",
  "created_at": "2026-10-02",
  "generator_version": "edu-career-pathways build.py sha256:0e5a0d40bce913e6b56eb3b8424e006e70eb867c0cbd28cc9d2ade579c6abc7e",
  "notes": [
    "dreamco_analysis is generated by build.py from build facts and the authored review files; it is not a human review.",
    "tier: generated (see plan.json and data/majors_selected.json).",
    "validation_evidence_ids: only regression evidence (if listed) exists. sandbox, benchmark and holdout are empty on purpose; evidence/pytest.txt is a build-integrity run and is not counted.",
    "perspectives_used has one entry: O*NET and the crosswalk are both official USDOL/ETA sources (closest policy perspective: official_documentation)."
  ]
}
